#BioGRID Interaction ID	Entrez Gene Interactor A	Entrez Gene Interactor B	BioGRID ID Interactor A	BioGRID ID Interactor B	Systematic Name Interactor A	Systematic Name Interactor B	Official Symbol Interactor A	Official Symbol Interactor B	Synonyms Interactor A	Synonyms Interactor B	Experimental System	Experimental System Type	Author	Pubmed ID	Organism Interactor A	Organism Interactor B	Throughput	Score	Modification	Phenotypes	Qualifications	Tags	Source Database
13611	367	10399	106862	115671	RP11-383C12.1	HLC7	AR	GNB2L1	AIS|DHTR|HUMARA|HYSP1|KD|NR3C4|SBMA|SMAX1|TFM	Gnb2-rs1|H12.3|HLC-7|PIG21|RACK1	Two-hybrid	physical	Rigas AC (2003)	12958311	9606	9606	Low Throughput	-	-	-	-	-	BIOGRID
17119	367	2316	106862	108605	RP11-383C12.1	XX-FW83128A1.1	AR	FLNA	AIS|DHTR|HUMARA|HYSP1|KD|NR3C4|SBMA|SMAX1|TFM	ABP-280|ABPX|CSBS|CVD1|FLN|FLN-A|FLN1|FMD|MNS|NHBP|OPD|OPD1|OPD2|XLVD|XMVD	Two-hybrid	physical	Loy CJ (2003)	12682292	9606	9606	Low Throughput	-	-	-	-	-	BIOGRID
18194	367	5901	106862	111837	RP11-383C12.1	OK/SW-cl.81	AR	RAN	AIS|DHTR|HUMARA|HYSP1|KD|NR3C4|SBMA|SMAX1|TFM	ARA24|Gsp1|TC4	Two-hybrid	physical	Hsiao PW (1999)	10400640	9606	9606	Low Throughput	-	-	-	-	-	BIOGRID
18233	367	7182	106862	113034	RP11-383C12.1	-	AR	NR2C2	AIS|DHTR|HUMARA|HYSP1|KD|NR3C4|SBMA|SMAX1|TFM	TAK1|TR4	Two-hybrid	physical	Lee YF (1999)	10611280	9606	9606	Low Throughput	-	-	-	-	-	BIOGRID
18239	367	8202	106862	113841	RP11-383C12.1	RP5-1049G16.3	AR	NCOA3	AIS|DHTR|HUMARA|HYSP1|KD|NR3C4|SBMA|SMAX1|TFM	ACTR|AIB-1|AIB1|CAGH16|CTG26|KAT13B|RAC3|SRC-3|SRC3|TNRC14|TNRC16|TRAM-1|bHLHe42|pCIP	Two-hybrid	physical	Tan JA (2000)	10965917	9606	9606	Low Throughput	-	-	-	-	-	BIOGRID
18248	367	6047	106862	111974	RP11-383C12.1	RES4-26	AR	RNF4	AIS|DHTR|HUMARA|HYSP1|KD|NR3C4|SBMA|SMAX1|TFM	SLX5|SNURF	Two-hybrid	physical	Moilanen AM (1998)	9710597	9606	9606	Low Throughput	-	-	-	-	-	BIOGRID
18250	367	6047	106862	111974	RP11-383C12.1	RES4-26	AR	RNF4	AIS|DHTR|HUMARA|HYSP1|KD|NR3C4|SBMA|SMAX1|TFM	SLX5|SNURF	Two-hybrid	physical	Poukka H (2000)	10617653	9606	9606	Low Throughput	-	-	-	-	-	BIOGRID
18281	367	8031	106862	113726	RP11-383C12.1	RP11-481A12.4	AR	NCOA4	AIS|DHTR|HUMARA|HYSP1|KD|NR3C4|SBMA|SMAX1|TFM	ARA70|ELE1|PTC3|RFG	Two-hybrid	physical	Alen P (1999)	9892017	9606	9606	Low Throughput	-	-	-	-	-	BIOGRID
18282	367	8031	106862	113726	RP11-383C12.1	RP11-481A12.4	AR	NCOA4	AIS|DHTR|HUMARA|HYSP1|KD|NR3C4|SBMA|SMAX1|TFM	ARA70|ELE1|PTC3|RFG	Two-hybrid	physical	Yeh S (1996)	8643607	9606	9606	Low Throughput	-	-	-	-	-	BIOGRID
18289	367	56924	106862	121251	RP11-383C12.1	-	AR	PAK6	AIS|DHTR|HUMARA|HYSP1|KD|NR3C4|SBMA|SMAX1|TFM	PAK5	Two-hybrid	physical	Yang F (2001)	11278661	9606	9606	Low Throughput	-	-	-	-	-	BIOGRID
18300	10048	367	115359	106862	-	RP11-383C12.1	RANBP9	AR	BPM-L|BPM90|RANBPM|RanBP7	AIS|DHTR|HUMARA|HYSP1|KD|NR3C4|SBMA|SMAX1|TFM	Two-hybrid	physical	Rao MA (2002)	12361945	9606	9606	Low Throughput	-	-	-	-	-	BIOGRID
18304	367	25898	106862	117406	RP11-383C12.1	-	AR	RCHY1	AIS|DHTR|HUMARA|HYSP1|KD|NR3C4|SBMA|SMAX1|TFM	ARNIP|CHIMP|PIRH2|PRO1996|RNF199|ZCHY|ZNF363	Two-hybrid	physical	Beitel LK (2002)	12200228	9606	9606	Low Throughput	-	-	-	-	-	BIOGRID
18312	367	9063	106862	114523	RP11-383C12.1	-	AR	PIAS2	AIS|DHTR|HUMARA|HYSP1|KD|NR3C4|SBMA|SMAX1|TFM	ARIP3|DIP|MIZ|MIZ1|PIASX|PIASX-ALPHA|PIASX-BETA|SIZ2|ZMIZ4	Two-hybrid	physical	Kotaja N (2000)	11117529	9606	9606	Low Throughput	-	-	-	-	-	BIOGRID
18313	367	9063	106862	114523	RP11-383C12.1	-	AR	PIAS2	AIS|DHTR|HUMARA|HYSP1|KD|NR3C4|SBMA|SMAX1|TFM	ARIP3|DIP|MIZ|MIZ1|PIASX|PIASX-ALPHA|PIASX-BETA|SIZ2|ZMIZ4	Two-hybrid	physical	Moilanen AM (1999)	9920921	9606	9606	Low Throughput	-	-	-	-	-	BIOGRID
243650	367	3172	106862	109414	RP11-383C12.1	RP5-1013A22.1	AR	HNF4A	AIS|DHTR|HUMARA|HYSP1|KD|NR3C4|SBMA|SMAX1|TFM	FRTS4|HNF4|HNF4a7|HNF4a8|HNF4a9|HNF4alpha|MODY|MODY1|NR2A1|NR2A21|TCF|TCF14	Co-localization	physical	Mulholland DJ (2003)	12944908	9606	9606	Low Throughput	-	-	-	62.0% colocalization of HcRed-AR and BC-EGFP in the presence of DHT and 63.3% colocalization of HcRed-Tcf/BC-EGFP in the absence of DHT	-	BIOGRID
243707	207	367	106710	106862	-	RP11-383C12.1	AKT1	AR	AKT|CWS6|PKB|PKB-ALPHA|PRKBA|RAC|RAC-ALPHA	AIS|DHTR|HUMARA|HYSP1|KD|NR3C4|SBMA|SMAX1|TFM	Reconstituted Complex	physical	Lin HK (2001)	11404460	9606	9606	Low Throughput	-	Phosphorylation	-	Akt phosphorylates the androgen receptor (AR) at Ser-210 and Ser-790. A mutation at AR Ser-210 results in the reversal of Akt-mediated suppression of AR transactivation	-	BIOGRID
243708	207	367	106710	106862	-	RP11-383C12.1	AKT1	AR	AKT|CWS6|PKB|PKB-ALPHA|PRKBA|RAC|RAC-ALPHA	AIS|DHTR|HUMARA|HYSP1|KD|NR3C4|SBMA|SMAX1|TFM	Affinity Capture-Western	physical	Lin HK (2001)	11404460	9606	9606	Low Throughput	-	Phosphorylation	-	Akt phosphorylates the androgen receptor (AR) at Ser-210 and Ser-790. A mutation at AR Ser-210 results in the reversal of Akt-mediated suppression of AR transactivation	-	BIOGRID
243728	367	3572	106862	109786	RP11-383C12.1	-	AR	IL6ST	AIS|DHTR|HUMARA|HYSP1|KD|NR3C4|SBMA|SMAX1|TFM	CD130|CDW130|GP130|IL-6RB	Affinity Capture-Western	physical	Xie S (2004)	15129430	9606	9606	Low Throughput	-	-	-	Androgen treatment enhances the interaction between AR and gp130, interrupts the IL-6-induced gp130-mediated PI3K activation	-	BIOGRID
243733	8031	367	113726	106862	RP11-481A12.4	RP11-383C12.1	NCOA4	AR	ARA70|ELE1|PTC3|RFG	AIS|DHTR|HUMARA|HYSP1|KD|NR3C4|SBMA|SMAX1|TFM	Two-hybrid	physical	Miyamoto H (1998)	9636157	9606	9606	Low Throughput	-	-	-	Antiandrogens, hydroxyflutamide, bicalutamide (casodex), cyproterone acetate, and RU58841, and other compounds such as genistein and RU486, can promote the interaction between AR and its coactivator, ARA70, in a dose-dependent manner	-	BIOGRID
243736	801	367	107252	106862	-	RP11-383C12.1	CALM1	AR	CALML2|CAMI|CPVT4|DD132|PHKD|caM	AIS|DHTR|HUMARA|HYSP1|KD|NR3C4|SBMA|SMAX1|TFM	Affinity Capture-Western	physical	Cifuentes E (2004)	14695896	9606	9606	Low Throughput	-	-	-	AR binding to CaM was Ca(2+)-dependent and was inhibited by pretreatment of the cell extracts with W-7	-	BIOGRID
243738	5883	367	111820	106862	-	RP11-383C12.1	RAD9A	AR	RAD9	AIS|DHTR|HUMARA|HYSP1|KD|NR3C4|SBMA|SMAX1|TFM	Two-hybrid	physical	Wang L (2004)	14966297	9606	9606	Low Throughput	-	-	-	AR can interact with the C terminus of hRad9 via its ligand binding domain. The FXXLF motif within the C terminus of hRad9 interrupts the androgen-induced interaction between the N terminus and C terminus of AR	-	BIOGRID
243740	367	4088	106862	110263	RP11-383C12.1	-	AR	SMAD3	AIS|DHTR|HUMARA|HYSP1|KD|NR3C4|SBMA|SMAX1|TFM	HSPC193|HsT17436|JV15-2|LDS1C|LDS3|MADH3	Affinity Capture-Western	physical	Chipuk JE (2002)	11707452	9606	9606	Low Throughput	-	-	-	AR directly associates with Smad3 but not Smad2 or Smad4. Electrophoretic mobility shift assays indicate that the AR ligand binding domain directly inhibits the association of Smad3 to the Smad-binding element	-	BIOGRID
243742	23054	367	116691	106862	RP5-1181N3.2	RP11-383C12.1	NCOA6	AR	AIB3|ASC2|NRC|PRIP|RAP250|TRBP	AIS|DHTR|HUMARA|HYSP1|KD|NR3C4|SBMA|SMAX1|TFM	Two-hybrid	physical	Goo YH (2004)	14645241	9606	9606	Low Throughput	-	-	-	AR interacted with ASC2-2b that consists of the ASC-2 residues 622-849 in a testosterone-independent manner; indirect	-	BIOGRID
243865	1499	367	107880	106862	OK/SW-cl.35	RP11-383C12.1	CTNNB1	AR	CTNNB|MRD19|armadillo	AIS|DHTR|HUMARA|HYSP1|KD|NR3C4|SBMA|SMAX1|TFM	Reconstituted Complex	physical	Yang F (2002)	11792709	9606	9606	Low Throughput	-	-	-	Beta-catenin showed a strong interaction with AR but not with other steroid hormone receptors such as estrogen receptor alpha, progesterone receptor beta, and glucocorticoid receptor;ligand binding domain of AR and the NH(2) terminus combined with the fir	-	BIOGRID
243866	1499	367	107880	106862	OK/SW-cl.35	RP11-383C12.1	CTNNB1	AR	CTNNB|MRD19|armadillo	AIS|DHTR|HUMARA|HYSP1|KD|NR3C4|SBMA|SMAX1|TFM	Two-hybrid	physical	Yang F (2002)	11792709	9606	9606	Low Throughput	-	-	-	Beta-catenin showed a strong interaction with AR but not with other steroid hormone receptors such as estrogen receptor alpha, progesterone receptor beta, and glucocorticoid receptor;ligand binding domain of AR and the NH(2) terminus combined with the fir	-	BIOGRID
244036	8031	367	113726	106862	RP11-481A12.4	RP11-383C12.1	NCOA4	AR	ARA70|ELE1|PTC3|RFG	AIS|DHTR|HUMARA|HYSP1|KD|NR3C4|SBMA|SMAX1|TFM	Two-hybrid	physical	Lin HK (2001)	11404460	9606	9606	Low Throughput	-	-	-	cAkt repressed the AR and ARA70 interaction as well as the LY294002 enhancement of the interaction between the AR and ARA70;cAkt and dAkt, however, had very little effect on the interaction between GAL4 fused AR-LBD (amino acids 653-918) and VP16-fused AR	-	BIOGRID
244051	367	902	106862	107342	RP11-383C12.1	-	AR	CCNH	AIS|DHTR|HUMARA|HYSP1|KD|NR3C4|SBMA|SMAX1|TFM	CAK|CycH|p34|p37	Reconstituted Complex	physical	Lee DK (2000)	10734072	9606	9606	Low Throughput	-	-	-	Cdk activating kinase (CAK), the kinase moiety of TFIIH, enhanced AR-mediated transcription in a ligand-dependent manner;AR NH(2)-terminal domain interacting with CAK was essential for the CAK-induced AR transactivation	-	BIOGRID
244052	367	1022	106862	107457	RP11-383C12.1	-	AR	CDK7	AIS|DHTR|HUMARA|HYSP1|KD|NR3C4|SBMA|SMAX1|TFM	CAK1|CDKN7|HCAK|MO15|STK1|p39MO15	Affinity Capture-Western	physical	Lee DK (2000)	10734072	9606	9606	Low Throughput	-	-	-	Cdk activating kinase (CAK), the kinase moiety of TFIIH, enhanced AR-mediated transcription in a ligand-dependent manner;AR NH(2)-terminal domain interacting with CAK was essential for the CAK-induced AR transactivation	-	BIOGRID
244053	367	1022	106862	107457	RP11-383C12.1	-	AR	CDK7	AIS|DHTR|HUMARA|HYSP1|KD|NR3C4|SBMA|SMAX1|TFM	CAK1|CDKN7|HCAK|MO15|STK1|p39MO15	Reconstituted Complex	physical	Lee DK (2000)	10734072	9606	9606	Low Throughput	-	-	-	Cdk activating kinase (CAK), the kinase moiety of TFIIH, enhanced AR-mediated transcription in a ligand-dependent manner;AR NH(2)-terminal domain interacting with CAK was essential for the CAK-induced AR transactivation	-	BIOGRID
244125	367	367	106862	106862	RP11-383C12.1	RP11-383C12.1	AR	AR	AIS|DHTR|HUMARA|HYSP1|KD|NR3C4|SBMA|SMAX1|TFM	AIS|DHTR|HUMARA|HYSP1|KD|NR3C4|SBMA|SMAX1|TFM	Protein-peptide	physical	He B (2004)	15525515	9606	9606	Low Throughput	-	-	-	Crystal structures of the ligand-activated AR ligand binding domain with and without bound FXXLF and LXXLL peptides	-	BIOGRID
244126	367	367	106862	106862	RP11-383C12.1	RP11-383C12.1	AR	AR	AIS|DHTR|HUMARA|HYSP1|KD|NR3C4|SBMA|SMAX1|TFM	AIS|DHTR|HUMARA|HYSP1|KD|NR3C4|SBMA|SMAX1|TFM	Co-crystal Structure	physical	He B (2004)	15525515	9606	9606	Low Throughput	-	-	-	Crystal structures of the ligand-activated AR ligand binding domain with and without bound FXXLF and LXXLL peptides	-	BIOGRID
244162	1616	367	107985	106862	DADB-159G18.9	RP11-383C12.1	DAXX	AR	BING2|DAP6|EAP1	AIS|DHTR|HUMARA|HYSP1|KD|NR3C4|SBMA|SMAX1|TFM	Two-hybrid	physical	Lin DY (2004)	15572661	9606	9606	Low Throughput	-	-	-	Daxx binds to both the amino-terminal and the DNA-binding domain of the AR. Daxx proteins interfere with the AR DNA-binding activity both in vitro and in vivo. Moreover, sumoylation of AR at its amino-terminal domain is involved in Daxx interaction and tr	-	BIOGRID
244163	1616	367	107985	106862	DADB-159G18.9	RP11-383C12.1	DAXX	AR	BING2|DAP6|EAP1	AIS|DHTR|HUMARA|HYSP1|KD|NR3C4|SBMA|SMAX1|TFM	Reconstituted Complex	physical	Lin DY (2004)	15572661	9606	9606	Low Throughput	-	-	-	Daxx binds to both the amino-terminal and the DNA-binding domain of the AR. Daxx proteins interfere with the AR DNA-binding activity both in vitro and in vivo. Moreover, sumoylation of AR at its amino-terminal domain is involved in Daxx interaction and tr	-	BIOGRID
244164	1616	367	107985	106862	DADB-159G18.9	RP11-383C12.1	DAXX	AR	BING2|DAP6|EAP1	AIS|DHTR|HUMARA|HYSP1|KD|NR3C4|SBMA|SMAX1|TFM	Affinity Capture-Western	physical	Lin DY (2004)	15572661	9606	9606	Low Throughput	-	-	-	Daxx binds to both the amino-terminal and the DNA-binding domain of the AR. Daxx proteins interfere with the AR DNA-binding activity both in vitro and in vivo. Moreover, sumoylation of AR at its amino-terminal domain is involved in Daxx interaction and tr	-	BIOGRID
244170	367	6774	106862	112651	RP11-383C12.1	-	AR	STAT3	AIS|DHTR|HUMARA|HYSP1|KD|NR3C4|SBMA|SMAX1|TFM	ADMIO|APRF|HIES	Affinity Capture-Western	physical	Matsuda T (2001)	11322786	9606	9606	Low Throughput	-	-	-	DHT treatment augmented endogenous STAT3-mediated gene expression by IL-6. Conversely, DHT-induced AR activity was increased by IL-6, and a dominant negative form of STAT3 inhibited AR activation. In contrast, DHT-mediated enhancement of STAT3 activation	-	BIOGRID
244172	367	6774	106862	112651	RP11-383C12.1	-	AR	STAT3	AIS|DHTR|HUMARA|HYSP1|KD|NR3C4|SBMA|SMAX1|TFM	ADMIO|APRF|HIES	Reconstituted Complex	physical	Ueda T (2002)	11751884	9606	9606	Low Throughput	-	-	-	Direct interaction between amino acids 234-558 of the AR NTD and STAT3 following IL-6 treatment	-	BIOGRID
244200	367	367	106862	106862	RP11-383C12.1	RP11-383C12.1	AR	AR	AIS|DHTR|HUMARA|HYSP1|KD|NR3C4|SBMA|SMAX1|TFM	AIS|DHTR|HUMARA|HYSP1|KD|NR3C4|SBMA|SMAX1|TFM	Two-hybrid	physical	Minamiguchi K (2004)	15062556	9606	9606	Low Throughput	-	-	-	Ectopic expression of ARN34 (N-terminal (1-34) peptide) suppressed both androgen-dependent AR N-to-C interaction and prostate specific antigen transcription	-	BIOGRID
244205	8031	367	113726	106862	RP11-481A12.4	RP11-383C12.1	NCOA4	AR	ARA70|ELE1|PTC3|RFG	AIS|DHTR|HUMARA|HYSP1|KD|NR3C4|SBMA|SMAX1|TFM	Reconstituted Complex	physical	Alen P (1999)	9892017	9606	9606	Low Throughput	-	-	-	ELE1alpha and ELE1beta interact in vitro with the AR, but also with the GR and the ER, in a ligand-independent way	-	BIOGRID
244250	6667	367	112550	106862	-	RP11-383C12.1	SP1	AR	-	AIS|DHTR|HUMARA|HYSP1|KD|NR3C4|SBMA|SMAX1|TFM	Affinity Capture-Western	physical	Yuan H (2005)	15661808	9606	9606	Low Throughput	-	-	-	Enhancing activity of Sp1 could be repressed by quercetin;quercetin caused changes in post-translational modification of AR protein and in states of physical interaction of Sp1 with the AR	-	BIOGRID
244384	2932	367	109187	106862	-	RP11-383C12.1	GSK3B	AR	-	AIS|DHTR|HUMARA|HYSP1|KD|NR3C4|SBMA|SMAX1|TFM	Reconstituted Complex	physical	Wang L (2004)	15178691	9606	9606	Low Throughput	-	Phosphorylation	-	GSK3 beta prefers to phosphorylate the amino terminus of AR that may lead to the suppression of activation function 1 activity;GSK3 beta interrupted the interaction between the NH(2) and COOH termini of AR	-	BIOGRID
244385	2932	367	109187	106862	-	RP11-383C12.1	GSK3B	AR	-	AIS|DHTR|HUMARA|HYSP1|KD|NR3C4|SBMA|SMAX1|TFM	Affinity Capture-Western	physical	Wang L (2004)	15178691	9606	9606	Low Throughput	-	Phosphorylation	-	GSK3 beta prefers to phosphorylate the amino terminus of AR that may lead to the suppression of activation function 1 activity;GSK3 beta interrupted the interaction between the NH(2) and COOH termini of AR	-	BIOGRID
244400	8031	367	113726	106862	RP11-481A12.4	RP11-383C12.1	NCOA4	AR	ARA70|ELE1|PTC3|RFG	AIS|DHTR|HUMARA|HYSP1|KD|NR3C4|SBMA|SMAX1|TFM	Two-hybrid	physical	Yeh S (1999)	10318905	9606	9606	Low Throughput	-	-	-	HER2/Neu-induced androgen receptor (AR) transactivation may function through the promotion of interaction between AR and AR coactivators, such as ARA70	-	BIOGRID
244407	2934	367	109189	106862	RP11-477J21.1	RP11-383C12.1	GSN	AR	ADF|AGEL	AIS|DHTR|HUMARA|HYSP1|KD|NR3C4|SBMA|SMAX1|TFM	Reconstituted Complex	physical	Nishimura K (2003)	12941811	9606	9606	Low Throughput	-	-	-	Hydroxyflutamide (HF), as well as androgens, can promote the interaction between AR and GSN in a dose-dependent manner;GSN interacts with AR DNA-binding domain and ligand-binding domain via its COOH-terminal domain;during nuclear translocation	-	BIOGRID
244474	8991	367	114472	106862	RP11-126K1.7	RP11-383C12.1	SELENBP1	AR	HEL-S-134P|LPSB|SBP56|SP56|hSBP	AIS|DHTR|HUMARA|HYSP1|KD|NR3C4|SBMA|SMAX1|TFM	Affinity Capture-Western	physical	Veldscholte J (1992)	1540595	9606	9606	Low Throughput	-	-	-	Incubation of the cells at 37 degrees C with androgen (R1881, 10 nM) or the anti-androgen hydroxyflutamide, prior to receptor isolation, resulted in dissociation of the AR-heat-shock protein complex	-	BIOGRID
244475	3303	367	109535	106862	DAQB-147D11.1	RP11-383C12.1	HSPA1A	AR	HEL-S-103|HSP70-1|HSP70-1A|HSP70I|HSP72|HSPA1	AIS|DHTR|HUMARA|HYSP1|KD|NR3C4|SBMA|SMAX1|TFM	Affinity Capture-Western	physical	Veldscholte J (1992)	1540595	9606	9606	Low Throughput	-	-	-	Incubation of the cells at 37 degrees C with androgen (R1881, 10 nM) or the anti-androgen hydroxyflutamide, prior to receptor isolation, resulted in dissociation of the AR-heat-shock protein complex	-	BIOGRID
244476	3320	367	109552	106862	-	RP11-383C12.1	HSP90AA1	AR	EL52|HSP86|HSP89A|HSP90A|HSP90N|HSPC1|HSPCA|HSPCAL1|HSPCAL4|HSPN|Hsp89|Hsp90|LAP-2|LAP2	AIS|DHTR|HUMARA|HYSP1|KD|NR3C4|SBMA|SMAX1|TFM	Affinity Capture-Western	physical	Veldscholte J (1992)	1540595	9606	9606	Low Throughput	-	-	-	Incubation of the cells at 37 degrees C with androgen (R1881, 10 nM) or the anti-androgen hydroxyflutamide, prior to receptor isolation, resulted in dissociation of the AR-heat-shock protein complex	-	BIOGRID
244484	8409	367	113997	106862	RP1-212G6.2	RP11-383C12.1	UXT	AR	ART-27|STAP1	AIS|DHTR|HUMARA|HYSP1|KD|NR3C4|SBMA|SMAX1|TFM	Two-hybrid	physical	Markus SM (2002)	11854421	9606	9606	Low Throughput	-	-	-	Interact predominantly with the AR(153-336), containing AF-1a and a part of AF-1b;interacts with AR in a ligand-independent manner;part of a multiprotein complex	-	BIOGRID
244490	857	367	107305	106862	-	RP11-383C12.1	CAV1	AR	BSCL3|CGL3|LCCNS|MSTP085|PPH3|VIP21	AIS|DHTR|HUMARA|HYSP1|KD|NR3C4|SBMA|SMAX1|TFM	Affinity Capture-Western	physical	Lu ML (2001)	11278309	9606	9606	Low Throughput	-	-	-	Interaction between AR and caveolin-1 is an androgen-dependent process;NH(2) terminus region of caveolin-1 is responsible for the interaction with both the NH(2)-terminal domain and the ligand-binding domain of AR	-	BIOGRID
244491	857	367	107305	106862	-	RP11-383C12.1	CAV1	AR	BSCL3|CGL3|LCCNS|MSTP085|PPH3|VIP21	AIS|DHTR|HUMARA|HYSP1|KD|NR3C4|SBMA|SMAX1|TFM	Two-hybrid	physical	Lu ML (2001)	11278309	9606	9606	Low Throughput	-	-	-	Interaction between AR and caveolin-1 is an androgen-dependent process;NH(2) terminus region of caveolin-1 is responsible for the interaction with both the NH(2)-terminal domain and the ligand-binding domain of AR	-	BIOGRID
244492	857	367	107305	106862	-	RP11-383C12.1	CAV1	AR	BSCL3|CGL3|LCCNS|MSTP085|PPH3|VIP21	AIS|DHTR|HUMARA|HYSP1|KD|NR3C4|SBMA|SMAX1|TFM	Reconstituted Complex	physical	Lu ML (2001)	11278309	9606	9606	Low Throughput	-	-	-	Interaction between AR and caveolin-1 is an androgen-dependent process;NH(2) terminus region of caveolin-1 is responsible for the interaction with both the NH(2)-terminal domain and the ligand-binding domain of AR	-	BIOGRID
244509	3725	367	109928	106862	-	RP11-383C12.1	JUN	AR	AP-1|AP1|c-Jun	AIS|DHTR|HUMARA|HYSP1|KD|NR3C4|SBMA|SMAX1|TFM	Affinity Capture-Western	physical	Sato N (1997)	9211894	9606	9606	Low Throughput	-	-	-	Interaction between the DNA- and ligand-binding domains of AR and the leucine zipper region of c-Jun	-	BIOGRID
244510	367	3725	106862	109928	RP11-383C12.1	-	AR	JUN	AIS|DHTR|HUMARA|HYSP1|KD|NR3C4|SBMA|SMAX1|TFM	AP-1|AP1|c-Jun	Affinity Capture-Western	physical	Sato N (1997)	9211894	9606	9606	Low Throughput	-	-	-	Interaction between the DNA- and ligand-binding domains of AR and the leucine zipper region of c-Jun	-	BIOGRID
244546	5591	367	111577	106862	-	RP11-383C12.1	PRKDC	AR	DNA-PKcs|DNAPK|DNPK1|HYRC|HYRC1|IMD26|XRCC7|p350	AIS|DHTR|HUMARA|HYSP1|KD|NR3C4|SBMA|SMAX1|TFM	Affinity Capture-MS	physical	Mayeur GL (2005)	15640154	9606	9606	Low Throughput	-	-	-	Interaction was localized to the androgen receptor ligand binding domain and is independent of DNA interactions. Ku interacts with AR in the cytoplasm and nucleus regardless of the presence or absence of androgen	-	BIOGRID
244547	367	7520	106862	113353	RP11-383C12.1	-	AR	XRCC5	AIS|DHTR|HUMARA|HYSP1|KD|NR3C4|SBMA|SMAX1|TFM	KARP-1|KARP1|KU80|KUB2|Ku86|NFIV	Reconstituted Complex	physical	Mayeur GL (2005)	15640154	9606	9606	Low Throughput	-	-	-	Interaction was localized to the androgen receptor ligand binding domain and is independent of DNA interactions. Ku interacts with AR in the cytoplasm and nucleus regardless of the presence or absence of androgen;Chromatin immunoprecipitation experiments	-	BIOGRID
244548	367	2547	106862	108822	RP11-383C12.1	CTA-216E10.7	AR	XRCC6	AIS|DHTR|HUMARA|HYSP1|KD|NR3C4|SBMA|SMAX1|TFM	CTC75|CTCBF|G22P1|KU70|ML8|TLAA	Affinity Capture-Western	physical	Mayeur GL (2005)	15640154	9606	9606	Low Throughput	-	-	-	Interaction was localized to the androgen receptor ligand binding domain and is independent of DNA interactions. Ku interacts with AR in the cytoplasm and nucleus regardless of the presence or absence of androgen;Chromatin immunoprecipitation experiments	-	BIOGRID
244551	573	367	107049	106862	RP11-326F20.2	RP11-383C12.1	BAG1	AR	BAG-1|HAP|RAP46	AIS|DHTR|HUMARA|HYSP1|KD|NR3C4|SBMA|SMAX1|TFM	Reconstituted Complex	physical	Shatkina L (2003)	14517289	9606	9606	Low Throughput	-	-	-	Interaction with the NH(2) and COOH termini of the receptor. At the NH(2) terminus of the receptor, Bag-1L interacts with a region termed tau 5;Hsp70 enhances the interaction of Bag-1L with the 5 domain of the AR;Bag-1M, a naturally occurring variant of B	-	BIOGRID
244586	1387	367	107777	106862	-	RP11-383C12.1	CREBBP	AR	CBP|KAT3A|RSTS	AIS|DHTR|HUMARA|HYSP1|KD|NR3C4|SBMA|SMAX1|TFM	Two-hybrid	physical	Kim J (2005)	15691881	9606	9606	Low Throughput	-	-	-	mammalian two-hybrid	-	BIOGRID
244588	367	1499	106862	107880	RP11-383C12.1	OK/SW-cl.35	AR	CTNNB1	AIS|DHTR|HUMARA|HYSP1|KD|NR3C4|SBMA|SMAX1|TFM	CTNNB|MRD19|armadillo	Two-hybrid	physical	Masiello D (2004)	15256534	9606	9606	Low Throughput	-	-	-	mammalian two-hybrid	-	BIOGRID
244589	367	1499	106862	107880	RP11-383C12.1	OK/SW-cl.35	AR	CTNNB1	AIS|DHTR|HUMARA|HYSP1|KD|NR3C4|SBMA|SMAX1|TFM	CTNNB|MRD19|armadillo	Two-hybrid	physical	Song LN (2004)	14593076	9606	9606	Low Throughput	-	-	-	mammalian two-hybrid	-	BIOGRID
244592	367	8648	106862	114200	RP11-383C12.1	-	AR	NCOA1	AIS|DHTR|HUMARA|HYSP1|KD|NR3C4|SBMA|SMAX1|TFM	F-SRC-1|KAT13A|RIP160|SRC1|bHLHe42|bHLHe74	Two-hybrid	physical	Masiello D (2004)	15256534	9606	9606	Low Throughput	-	-	-	mammalian two-hybrid	-	BIOGRID
244593	367	9611	106862	114973	RP11-383C12.1	-	AR	NCOR1	AIS|DHTR|HUMARA|HYSP1|KD|NR3C4|SBMA|SMAX1|TFM	N-CoR|N-CoR1|PPP1R109|TRAC1|hN-CoR	Two-hybrid	physical	Masiello D (2004)	15256534	9606	9606	Low Throughput	-	-	-	mammalian two-hybrid	-	BIOGRID
244594	367	9611	106862	114973	RP11-383C12.1	-	AR	NCOR1	AIS|DHTR|HUMARA|HYSP1|KD|NR3C4|SBMA|SMAX1|TFM	N-CoR|N-CoR1|PPP1R109|TRAC1|hN-CoR	Two-hybrid	physical	Song LN (2004)	14593076	9606	9606	Low Throughput	-	-	-	mammalian two-hybrid	-	BIOGRID
244595	367	9611	106862	114973	RP11-383C12.1	-	AR	NCOR1	AIS|DHTR|HUMARA|HYSP1|KD|NR3C4|SBMA|SMAX1|TFM	N-CoR|N-CoR1|PPP1R109|TRAC1|hN-CoR	Two-hybrid	physical	Cheng S (2002)	12089345	9606	9606	Low Throughput	-	-	-	mammalian two-hybrid	-	BIOGRID
244596	367	4088	106862	110263	RP11-383C12.1	-	AR	SMAD3	AIS|DHTR|HUMARA|HYSP1|KD|NR3C4|SBMA|SMAX1|TFM	HSPC193|HsT17436|JV15-2|LDS1C|LDS3|MADH3	Two-hybrid	physical	Hayes SA (2001)	11280774	9606	9606	Low Throughput	-	-	-	mammalian two-hybrid	-	BIOGRID
244597	367	9612	106862	114974	RP11-383C12.1	-	AR	NCOR2	AIS|DHTR|HUMARA|HYSP1|KD|NR3C4|SBMA|SMAX1|TFM	CTG26|N-CoR2|SMAP270|SMRT|SMRTE|SMRTE-tau|TNRC14|TRAC|TRAC-1|TRAC1	Two-hybrid	physical	Liao G (2003)	12441355	9606	9606	Low Throughput	-	-	-	mammalian two-hybrid	-	BIOGRID
244598	367	9612	106862	114974	RP11-383C12.1	-	AR	NCOR2	AIS|DHTR|HUMARA|HYSP1|KD|NR3C4|SBMA|SMAX1|TFM	CTG26|N-CoR2|SMAP270|SMRT|SMRTE|SMRTE-tau|TNRC14|TRAC|TRAC-1|TRAC1	Reconstituted Complex	physical	Liao G (2003)	12441355	9606	9606	Low Throughput	-	-	-	mammalian two-hybrid	-	BIOGRID
244599	367	9612	106862	114974	RP11-383C12.1	-	AR	NCOR2	AIS|DHTR|HUMARA|HYSP1|KD|NR3C4|SBMA|SMAX1|TFM	CTG26|N-CoR2|SMAP270|SMRT|SMRTE|SMRTE-tau|TNRC14|TRAC|TRAC-1|TRAC1	Co-localization	physical	Liao G (2003)	12441355	9606	9606	Low Throughput	-	-	-	mammalian two-hybrid	-	BIOGRID
244600	367	9612	106862	114974	RP11-383C12.1	-	AR	NCOR2	AIS|DHTR|HUMARA|HYSP1|KD|NR3C4|SBMA|SMAX1|TFM	CTG26|N-CoR2|SMAP270|SMRT|SMRTE|SMRTE-tau|TNRC14|TRAC|TRAC-1|TRAC1	Two-hybrid	physical	Song LN (2004)	14593076	9606	9606	Low Throughput	-	-	-	mammalian two-hybrid	-	BIOGRID
244601	367	9612	106862	114974	RP11-383C12.1	-	AR	NCOR2	AIS|DHTR|HUMARA|HYSP1|KD|NR3C4|SBMA|SMAX1|TFM	CTG26|N-CoR2|SMAP270|SMRT|SMRTE|SMRTE-tau|TNRC14|TRAC|TRAC-1|TRAC1	Two-hybrid	physical	Dotzlaw H (2002)	11923464	9606	9606	Low Throughput	-	-	-	mammalian two-hybrid	-	BIOGRID
244603	367	10499	106862	115761	RP11-383C12.1	-	AR	NCOA2	AIS|DHTR|HUMARA|HYSP1|KD|NR3C4|SBMA|SMAX1|TFM	GRIP1|KAT13C|NCoA-2|SRC2|TIF2|bHLHe75	Two-hybrid	physical	Song LN (2004)	14593076	9606	9606	Low Throughput	-	-	-	mammalian two-hybrid	-	BIOGRID
244604	595	367	107067	106862	-	RP11-383C12.1	CCND1	AR	BCL1|D11S287E|PRAD1|U21B31	AIS|DHTR|HUMARA|HYSP1|KD|NR3C4|SBMA|SMAX1|TFM	Affinity Capture-Western	physical	Petre-Draviam CE (2005)	15558026	9606	9606	Low Throughput	-	-	-	Map the region of cyclin D1 required for binding and repression of the androgen receptor (AR) to a central, exclusively alpha-helical domain	-	BIOGRID
244605	595	367	107067	106862	-	RP11-383C12.1	CCND1	AR	BCL1|D11S287E|PRAD1|U21B31	AIS|DHTR|HUMARA|HYSP1|KD|NR3C4|SBMA|SMAX1|TFM	Reconstituted Complex	physical	Petre-Draviam CE (2005)	15558026	9606	9606	Low Throughput	-	-	-	Map the region of cyclin D1 required for binding and repression of the androgen receptor (AR) to a central, exclusively alpha-helical domain	-	BIOGRID
